{
  "interview_id": "new_user_onboarding",
  "interview_title": "Welcome! Let's get to know you better",
  "interview_description": "This quick interview helps us personalize your writing experience",
  "show_progress": true,
  "questions": [
    {
      "id": "writing_experience",
      "order": 1,
      "question": "What best describes your writing background?",
      "subtitle": "Check all that apply",
      "purpose": "This helps us understand your skill level and tailor the AI assistance complexity accordingly.",
      "ui_type": "multiple_choice",
      "display_type": "button_cards",
      "required": true,
      "min_selections": 1,
      "options": [
        {
          "id": "never_written",
          "label": "I've never written a story before",
          "value": "never_written"
        },
        {
          "id": "write_for_fun",
          "label": "I write stories for fun",
          "value": "write_for_fun"
        },
        {
          "id": "assignment",
          "label": "I'm completing an assignment",
          "value": "assignment"
        },
        {
          "id": "published_book",
          "label": "I've written a published book",
          "value": "published_book"
        },
        {
          "id": "professional_unpublished",
          "label": "I write professionally (but not published yet)",
          "value": "professional_unpublished"
        },
        {
          "id": "blog_online",
          "label": "I blog or write online content",
          "value": "blog_online"
        },
        {
          "id": "fanfiction",
          "label": "I write fanfiction",
          "value": "fanfiction"
        },
        {
          "id": "unfinished_stories",
          "label": "I've written stories but never finished one",
          "value": "unfinished_stories"
        },
        {
          "id": "poetry_short",
          "label": "I write poetry or short pieces",
          "value": "poetry_short"
        },
        {
          "id": "journalist",
          "label": "I'm a journalist/content writer",
          "value": "journalist"
        },
        {
          "id": "work_writing",
          "label": "I write as part of my job",
          "value": "work_writing"
        },
        {
          "id": "self_published",
          "label": "I've self-published my work",
          "value": "self_published"
        }
      ]
    },
    {
      "id": "genre_preferences",
      "order": 2,
      "question": "Select all the genres that appeal to you",
      "subtitle": "Check all that apply",
      "purpose": "This helps us suggest appropriate story templates, world-building elements, and genre-specific AI prompts tailored to your interests.",
      "ui_type": "multiple_choice",
      "display_type": "button_cards_with_tooltip",
      "required": true,
      "min_selections": 1,
      "options": [
        {
          "id": "scifi",
          "label": "Sci-fi",
          "value": "scifi",
          "tooltip": "Stories set in the future or alternate realities, featuring advanced technology, space exploration, or scientific concepts"
        },
        {
          "id": "romance",
          "label": "Romance",
          "value": "romance",
          "tooltip": "Stories centered on romantic relationships and emotional connections between characters"
        },
        {
          "id": "fantasy",
          "label": "Fantasy",
          "value": "fantasy",
          "tooltip": "Stories with magical elements, mythical creatures, and imaginary worlds beyond reality"
        },
        {
          "id": "mystery",
          "label": "Mystery",
          "value": "mystery",
          "tooltip": "Stories focused on solving puzzles, crimes, or unexplained events through investigation"
        },
        {
          "id": "horror",
          "label": "Horror",
          "value": "horror",
          "tooltip": "Stories designed to frighten, unsettle, or create suspense through supernatural or psychological elements"
        },
        {
          "id": "childrens",
          "label": "Children's",
          "value": "childrens",
          "tooltip": "Stories written for young readers, featuring age-appropriate themes and simple language"
        },
        {
          "id": "nonfiction",
          "label": "Nonfiction",
          "value": "nonfiction",
          "tooltip": "True stories, educational content, or informational writing based on real events and facts"
        },
        {
          "id": "adventure",
          "label": "Adventure",
          "value": "adventure",
          "tooltip": "Action-packed stories featuring quests, exploration, and exciting challenges"
        },
        {
          "id": "historical_fiction",
          "label": "Historical Fiction",
          "value": "historical_fiction",
          "tooltip": "Stories set in the past that blend historical facts with fictional characters and events"
        },
        {
          "id": "thriller_suspense",
          "label": "Thriller/Suspense",
          "value": "thriller_suspense",
          "tooltip": "Fast-paced stories with high stakes, danger, and constant tension"
        },
        {
          "id": "literary_fiction",
          "label": "Literary Fiction",
          "value": "literary_fiction",
          "tooltip": "Character-driven stories focusing on theme, style, and psychological depth"
        },
        {
          "id": "young_adult",
          "label": "Young Adult (YA)",
          "value": "young_adult",
          "tooltip": "Stories for teens and young adults, often featuring coming-of-age themes"
        },
        {
          "id": "dystopian",
          "label": "Dystopian",
          "value": "dystopian",
          "tooltip": "Stories set in imagined societies with oppressive control or post-apocalyptic settings"
        },
        {
          "id": "comedy_humor",
          "label": "Comedy/Humor",
          "value": "comedy_humor",
          "tooltip": "Light-hearted stories designed to entertain and make readers laugh"
        },
        {
          "id": "slice_of_life",
          "label": "Slice of Life",
          "value": "slice_of_life",
          "tooltip": "Realistic stories focusing on everyday experiences and character relationships"
        },
        {
          "id": "crime_detective",
          "label": "Crime/Detective",
          "value": "crime_detective",
          "tooltip": "Stories following law enforcement or private investigators solving criminal cases"
        },
        {
          "id": "paranormal",
          "label": "Paranormal",
          "value": "paranormal",
          "tooltip": "Stories featuring supernatural beings like vampires, ghosts, or werewolves in modern settings"
        },
        {
          "id": "western",
          "label": "Western",
          "value": "western",
          "tooltip": "Stories set in the American Old West, featuring cowboys, outlaws, and frontier life"
        },
        {
          "id": "war_military",
          "label": "War/Military",
          "value": "war_military",
          "tooltip": "Stories centered on warfare, military life, or the impact of conflict on individuals"
        },
        {
          "id": "sports",
          "label": "Sports",
          "value": "sports",
          "tooltip": "Stories featuring athletic competition, team dynamics, and personal triumph through sports"
        },
        {
          "id": "memoir_biography",
          "label": "Memoir/Biography",
          "value": "memoir_biography",
          "tooltip": "Personal life stories and experiences, either your own or about real people"
        },
        {
          "id": "self_help",
          "label": "Self-help/How-to",
          "value": "self_help",
          "tooltip": "Instructional content designed to help readers improve skills or solve problems"
        },
        {
          "id": "poetry",
          "label": "Poetry",
          "value": "poetry",
          "tooltip": "Expressive writing using rhythm, imagery, and condensed language to convey emotions"
        },
        {
          "id": "graphic_novel",
          "label": "Graphic Novel/Comics",
          "value": "graphic_novel",
          "tooltip": "Visual storytelling combining illustrations with text in sequential panels"
        },
        {
          "id": "magical_realism",
          "label": "Magical Realism",
          "value": "magical_realism",
          "tooltip": "Stories blending realistic settings with subtle magical elements accepted as normal"
        }
      ]
    },
    {
      "id": "help_needed",
      "order": 3,
      "question": "What aspects of writing would you like help with?",
      "subtitle": "Check all that apply",
      "purpose": "This helps us prioritize which features to highlight and customize your dashboard to show the most relevant tools for your needs.",
      "ui_type": "multiple_choice",
      "display_type": "button_cards",
      "required": true,
      "min_selections": 1,
      "options": [
        {
          "id": "brainstorming",
          "label": "Brainstorming ideas",
          "value": "brainstorming"
        },
        {
          "id": "characters",
          "label": "Building compelling characters",
          "value": "characters"
        },
        {
          "id": "world_building",
          "label": "Creating detailed worlds/settings",
          "value": "world_building"
        },
        {
          "id": "writing_habits",
          "label": "Developing consistent writing habits",
          "value": "writing_habits"
        },
        {
          "id": "editing",
          "label": "Editing and revision help",
          "value": "editing"
        },
        {
          "id": "writing_voice",
          "label": "Finding my writing voice",
          "value": "writing_voice"
        },
        {
          "id": "genre_guidance",
          "label": "Genre-specific guidance",
          "value": "genre_guidance"
        },
        {